Title,Plot Summary,Genre,Box-Office Collection,URL
Sherlock Jr.,"    A meek and mild projectionist, who also cleans up after screenings, would like nothing better than to be a private detective. He becomes engaged to a pretty girl but a ladies man known as the Sheik vies for her affection. He gets rid of the projectionist by stealing a pocket watch belonging to the girl's father - which he pawns to buy her an expensive box of candy. He then slips the pawn ticket into the projectionist's pocket and subsequently is found by the police. He doesn't have much luck but in his dreams, he the debonair and renowned detective Sherlock Jr. who faces danger and solves the crime. In real life, the girl solves crimes quickly.",Action,,https://www.imdb.com/title/tt0015324/?pf_rd_m=A2FGELUUNOQJNL&pf_rd_p=e31d89dd-322d-4646-8962-327b42fe94b1&pf_rd_r=RHFMPC8Y06M9ZGESJ2JN&pf_rd_s=center-1&pf_rd_t=15506&pf_rd_i=top&ref_=chttp_tt_157
Gone with the Wind,"    Scarlett is a woman who can deal with a nation at war, Atlanta burning, the Union Army carrying off everything from her beloved Tara, the carpetbaggers who arrive after the war. Scarlett is beautiful. She has vitality. But Ashley, the man she has wanted for so long, is going to marry his placid cousin, Melanie. Mammy warns Scarlett to behave herself at the party at Twelve Oaks. There is a new man there that day, the day the Civil War begins. Rhett Butler. Scarlett does not know he is in the room when she pleads with Ashley to choose her instead of Melanie.",Drama," $1,192,593",https://www.imdb.com/title/tt0031381/?pf_rd_m=A2FGELUUNOQJNL&pf_rd_p=e31d89dd-322d-4646-8962-327b42fe94b1&pf_rd_r=RHFMPC8Y06M9ZGESJ2JN&pf_rd_s=center-1&pf_rd_t=15506&pf_rd_i=top&ref_=chttp_tt_158
No Country for Old Men,"    In rural Texas, welder and hunter Llewelyn Moss (Josh Brolin) discovers the remains of several drug runners who have all killed each other in an exchange gone violently wrong. Rather than report the discovery to the police, Moss decides to simply take the two million dollars present for himself. This puts the psychopathic killer, Anton Chigurh (Javier Bardem), on his trail as he dispassionately murders nearly every rival, bystander and even employer in his pursuit of his quarry and the money. As Moss desperately attempts to keep one step ahead, the blood from this hunt begins to flow behind him with relentlessly growing intensity as Chigurh closes in. Meanwhile, the laconic Sheriff Ed Tom Bell (Tommy Lee Jones) blithely oversees the investigation even as he struggles to face the sheer enormity of the crimes he is attempting to thwart.",Crime," $1,226,333",https://www.imdb.com/title/tt0477348/?pf_rd_m=A2FGELUUNOQJNL&pf_rd_p=e31d89dd-322d-4646-8962-327b42fe94b1&pf_rd_r=RHFMPC8Y06M9ZGESJ2JN&pf_rd_s=center-1&pf_rd_t=15506&pf_rd_i=top&ref_=chttp_tt_159
The Sixth Sense,"    Malcom Crowe (Bruce Willis)is a child psychologist who receives an award on the same night that he is visited by a very unhappy ex-patient. After this encounter, Crowe takes on the task of curing a young boy with the same ills as the ex-patient (Donnie Wahlberg) . This boy ""sees dead people"". Crowe spends a lot of time with the boy much to the dismay of his wife (Olivia Williams). Cole's mom (Toni Collette) is at her wit's end with what to do about her son's increasing problems. Crowe is the boy's only hope.",Drama," $293,506",https://www.imdb.com/title/tt0167404/?pf_rd_m=A2FGELUUNOQJNL&pf_rd_p=e31d89dd-322d-4646-8962-327b42fe94b1&pf_rd_r=RHFMPC8Y06M9ZGESJ2JN&pf_rd_s=center-1&pf_rd_t=15506&pf_rd_i=top&ref_=chttp_tt_160
Gran Torino,"    Walt Kowalski is a widower who holds onto his prejudices despite the changes in his Michigan neighborhood and the world around him. Kowalski is a grumpy, tough-minded, unhappy old man who can't get along with either his kids or his neighbors. He is a Korean War veteran whose prize possession is a 1972 Gran Torino he keeps in mint condition. When his neighbor Thao, a young Hmong teenager under pressure from his gang member cousin, tries to steal his Gran Torino, Kowalski sets out to reform the youth. Drawn against his will into the life of Thao's family, Kowalski is soon taking steps to protect them from the gangs that infest their neighborhood.",Drama," $271,720",https://www.imdb.com/title/tt1205489/?pf_rd_m=A2FGELUUNOQJNL&pf_rd_p=e31d89dd-322d-4646-8962-327b42fe94b1&pf_rd_r=RHFMPC8Y06M9ZGESJ2JN&pf_rd_s=center-1&pf_rd_t=15506&pf_rd_i=top&ref_=chttp_tt_161
There Will Be Blood,"    The intersecting life stories of Daniel Plainview and Eli Sunday in early twentieth century California presents miner-turned-oilman Daniel Plainview, a driven man who will do whatever it takes to achieve his goals. He works hard but also takes advantage of those around him at their expense if need be. His business partner/son (H.W.) is, in reality, an ""acquired"" child whose true biological single-parent father (working on one of Daniel's rigs) died in a workplace accident. Daniel is deeply protective of H.W. if only for what H.W. brings to the partnership. Eli Sunday is one in a pair of twins whose family farm Daniel purchases for the major oil deposit located on it. Eli, a local preacher and a self-proclaimed faith healer, wants the money from the sale of the property to finance his own church. The lives of the two competitive men often clash as Daniel pumps oil off the property and tries to acquire all the surrounding land at bargain prices to be able to build a pipeline to the ...",Drama," $302,845",https://www.imdb.com/title/tt0469494/?pf_rd_m=A2FGELUUNOQJNL&pf_rd_p=e31d89dd-322d-4646-8962-327b42fe94b1&pf_rd_r=RHFMPC8Y06M9ZGESJ2JN&pf_rd_s=center-1&pf_rd_t=15506&pf_rd_i=top&ref_=chttp_tt_162
Fargo,"    Jerry works in his father-in-law's car dealership and has gotten himself in financial problems. He tries various schemes to come up with money needed for a reason that is never really explained. It has to be assumed that his huge embezzlement of money from the dealership is about to be discovered by father-in-law. When all else falls through, plans he set in motion earlier for two men to kidnap his wife for ransom to be paid by her wealthy father (who doesn't seem to have the time of day for son-in-law). From the moment of the kidnapping, things go wrong and what was supposed to be a non-violent affair turns bloody with more blood added by the minute. Jerry is upset at the bloodshed, which turns loose a pregnant sheriff from Brainerd, MN who is tenacious in attempting to solve the three murders in her jurisdiction.",Crime," $730,265",https://www.imdb.com/title/tt0116282/?pf_rd_m=A2FGELUUNOQJNL&pf_rd_p=e31d89dd-322d-4646-8962-327b42fe94b1&pf_rd_r=RHFMPC8Y06M9ZGESJ2JN&pf_rd_s=center-1&pf_rd_t=15506&pf_rd_i=top&ref_=chttp_tt_163
The Deer Hunter,"    Michael, Steven and Nick are young factory workers from Pennsylvania who enlist into the Army to fight in Vietnam. Before they go, Steven marries the pregnant Angela, and their wedding party also serves as the men's farewell party. After some time and many horrors, the three friends fall in the hands of the Vietcong and are brought to a prison camp in which they are forced to play Russian roulette against each other. Michael makes it possible for them to escape, but they soon get separated again.",Drama,,https://www.imdb.com/title/tt0077416/?pf_rd_m=A2FGELUUNOQJNL&pf_rd_p=e31d89dd-322d-4646-8962-327b42fe94b1&pf_rd_r=RHFMPC8Y06M9ZGESJ2JN&pf_rd_s=center-1&pf_rd_t=15506&pf_rd_i=top&ref_=chttp_tt_164
The Thing,"    A US research station, Antarctica, early-winter 1982. The base is suddenly buzzed by a helicopter from the nearby Norwegian research station. They are trying to kill a dog that has escaped from their base. After the destruction of the Norwegian chopper the members of the US team fly to the Norwegian base, only to discover them all dead or missing. They do find the remains of a strange creature the Norwegians burned. The Americans take it to their base and deduce that it is an alien life form. After a while it is apparent that the alien can take over and assimilate into other life forms, including humans, and can spread like a virus. This means that anyone at the base could be inhabited by The Thing, and tensions escalate.",Horror," $13,782",https://www.imdb.com/title/tt0084787/?pf_rd_m=A2FGELUUNOQJNL&pf_rd_p=e31d89dd-322d-4646-8962-327b42fe94b1&pf_rd_r=RHFMPC8Y06M9ZGESJ2JN&pf_rd_s=center-1&pf_rd_t=15506&pf_rd_i=top&ref_=chttp_tt_165
Finding Nemo,"    A clown fish named Marlin lives in the Great Barrier Reef loses his son, Nemo. After he ventures into the open sea, despite his father's constant warnings about many of the ocean's dangers. Nemo is abducted by a boat and netted up and sent to a dentist's office in Sydney. So, while Marlin ventures off to try to retrieve Nemo, Marlin meets a fish named Dory, a blue tang suffering from short-term memory loss. The companions travel a great distance, encountering various dangerous sea creatures such as sharks, anglerfish and jellyfish, in order to rescue Nemo from the dentist's office, which is situated by Sydney Harbour. While the two are doing this, Nemo and the other sea animals in the dentist's fish tank plot a way to return to Sydney Harbour to live their lives free again.",Animation," $70,251,710",https://www.imdb.com/title/tt0266543/?pf_rd_m=A2FGELUUNOQJNL&pf_rd_p=e31d89dd-322d-4646-8962-327b42fe94b1&pf_rd_r=RHFMPC8Y06M9ZGESJ2JN&pf_rd_s=center-1&pf_rd_t=15506&pf_rd_i=top&ref_=chttp_tt_166
The Big Lebowski,"    When ""The Dude"" Lebowski is mistaken for a millionaire Lebowski, two thugs urinate on his rug to coerce him into paying a debt he knows nothing about. While attempting to gain recompense for the ruined rug from his wealthy counterpart, he accepts a one-time job with high pay-off. He enlists the help of his bowling buddy, Walter, a gun-toting Jewish-convert with anger issues. Deception leads to more trouble, and it soon seems that everyone from porn empire tycoons to nihilists want something from The Dude.",Comedy," $17,498",https://www.imdb.com/title/tt0118715/?pf_rd_m=A2FGELUUNOQJNL&pf_rd_p=e31d89dd-322d-4646-8962-327b42fe94b1&pf_rd_r=RHFMPC8Y06M9ZGESJ2JN&pf_rd_s=center-1&pf_rd_t=15506&pf_rd_i=top&ref_=chttp_tt_167
Idi i smotri,"    The feature film directed by Elem Klimov, shot in the genre of military drama. The action takes place on the territory of Belarus in 1943. In the center of the story is a Belarusian boy, who witnesses the horrors of the Nazi punitive action, turning from a cheerful teenager into a gray-haired old man for two days.",Drama,,https://www.imdb.com/title/tt0091251/?pf_rd_m=A2FGELUUNOQJNL&pf_rd_p=e31d89dd-322d-4646-8962-327b42fe94b1&pf_rd_r=RHFMPC8Y06M9ZGESJ2JN&pf_rd_s=center-1&pf_rd_t=15506&pf_rd_i=top&ref_=chttp_tt_168
Kill Bill: Vol. 1,"    The lead character, called 'The Bride,' was a member of the Deadly Viper Assassination Squad, led by her lover 'Bill.' Upon realizing she was pregnant with Bill's child, 'The Bride' decided to escape her life as a killer. She fled to Texas, met a young man, who, on the day of their wedding rehearsal was gunned down by an angry and jealous Bill (with the assistance of the Deadly Viper Assassination Squad). Four years later, 'The Bride' wakes from a coma, and discovers her baby is gone. She, then, decides to seek revenge upon the five people who destroyed her life and killed her baby. The saga of Kill Bill Volume I begins.",Action," $22,089,322",https://www.imdb.com/title/tt0266697/?pf_rd_m=A2FGELUUNOQJNL&pf_rd_p=e31d89dd-322d-4646-8962-327b42fe94b1&pf_rd_r=RHFMPC8Y06M9ZGESJ2JN&pf_rd_s=center-1&pf_rd_t=15506&pf_rd_i=top&ref_=chttp_tt_169
Cool Hand Luke,"    Luke Jackson is a cool, gutsy prisoner in a Southern chain gang, who, while refusing to buckle under to authority, keeps escaping and being recaptured. The prisoners admire Luke because, as Dragline explains it, ""You're an original, that's what you are!"" Nevertheless, the camp staff actively works to crush Luke until he finally breaks.",Crime,,https://www.imdb.com/title/tt0061512/?pf_rd_m=A2FGELUUNOQJNL&pf_rd_p=e31d89dd-322d-4646-8962-327b42fe94b1&pf_rd_r=RHFMPC8Y06M9ZGESJ2JN&pf_rd_s=center-1&pf_rd_t=15506&pf_rd_i=top&ref_=chttp_tt_170
Rebecca,"    A shy ladies' companion, staying in Monte Carlo with her stuffy employer, meets the wealthy Maxim de Winter. She and Max fall in love, marry and return to Manderley, his large country estate in Cornwall. Max is still troubled by the death of his first wife, Rebecca, in a boating accident the year before. The second Mrs. de Winter clashes with the housekeeper, Mrs. Danvers, and discovers that Rebecca still has a strange hold on everyone at Manderley.",Drama,,https://www.imdb.com/title/tt0032976/?pf_rd_m=A2FGELUUNOQJNL&pf_rd_p=e31d89dd-322d-4646-8962-327b42fe94b1&pf_rd_r=RHFMPC8Y06M9ZGESJ2JN&pf_rd_s=center-1&pf_rd_t=15506&pf_rd_i=top&ref_=chttp_tt_171
Shutter Island,"    It's 1954, and up-and-coming U.S. marshal Teddy Daniels is assigned to investigate the disappearance of a patient from Boston's Shutter Island Ashecliffe Hospital. He's been pushing for an assignment on the island for personal reasons, but before long he wonders whether he hasn't been brought there as part of a twisted plot by hospital doctors whose radical treatments range from unethical to illegal to downright sinister. Teddy's shrewd investigating skills soon provide a promising lead, but the hospital refuses him access to records he suspects would break the case wide open. As a hurricane cuts off communication with the mainland, more dangerous criminals ""escape"" in the confusion, and the puzzling, improbable clues multiply, Teddy begins to doubt everything - his memory, his partner, even his own sanity.",Mystery," $128,012,934",https://www.imdb.com/title/tt1130884/?pf_rd_m=A2FGELUUNOQJNL&pf_rd_p=e31d89dd-322d-4646-8962-327b42fe94b1&pf_rd_r=RHFMPC8Y06M9ZGESJ2JN&pf_rd_s=center-1&pf_rd_t=15506&pf_rd_i=top&ref_=chttp_tt_172
Sunrise: A Song of Two Humans,"    In this fable-morality subtitled ""A Song of Two Humans"", the ""evil"" temptress is a city woman who bewitches farmer Anses and tries to convince him to murder his neglected wife, Indre.",Drama,,https://www.imdb.com/title/tt0018455/?pf_rd_m=A2FGELUUNOQJNL&pf_rd_p=e31d89dd-322d-4646-8962-327b42fe94b1&pf_rd_r=RHFMPC8Y06M9ZGESJ2JN&pf_rd_s=center-1&pf_rd_t=15506&pf_rd_i=top&ref_=chttp_tt_173
Tôkyô monogatari,"    An elderly couple journey to Tokyo to visit their children and are confronted by indifference, ingratitude and selfishness. When the parents are packed off to a resort by their busy, impatient children, the film deepens into an unbearably moving meditation on mortality.",Drama,,https://www.imdb.com/title/tt0046438/?pf_rd_m=A2FGELUUNOQJNL&pf_rd_p=e31d89dd-322d-4646-8962-327b42fe94b1&pf_rd_r=RHFMPC8Y06M9ZGESJ2JN&pf_rd_s=center-1&pf_rd_t=15506&pf_rd_i=top&ref_=chttp_tt_174
Hacksaw Ridge,"    The true story of Desmond T. Doss, the conscientious objector who, at the Battle of Okinawa, was awarded the Congressional Medal of Honor for his incredible bravery and regard for his fellow soldiers. We see his upbringing and how this shaped his views, especially his religious view and anti-killing stance. We see Doss's trials and tribulations after enlisting in the US Army and trying to become a medic. Finally, we see the hell on Earth that was Hacksaw Ridge.",Biography," $15,190,758",https://www.imdb.com/title/tt2119532/?pf_rd_m=A2FGELUUNOQJNL&pf_rd_p=e31d89dd-322d-4646-8962-327b42fe94b1&pf_rd_r=RHFMPC8Y06M9ZGESJ2JN&pf_rd_s=center-1&pf_rd_t=15506&pf_rd_i=top&ref_=chttp_tt_175
Mary and Max,"    In the mid-1970's, a homely, friendless Australian girl of 8 picks a name out of a Manhattan phone book and writes to him; she includes a chocolate bar. She's Mary Dinkle, the only child of an alcoholic mother and a distracted father. He's Max Horowitz, an overweight man with Asperger's, living alone in New York. He writes back, with chocolate. Thus begins a 20-year correspondence, interrupted by a stay in an asylum and a few misunderstandings. Mary falls in love with a neighbor, saves money to have a birthmark removed and deals with loss. Max has a friendship with a neighbor, tries to control his weight, and finally gets the dream job. Will the two ever meet face to face?",Animation, AUD 156,https://www.imdb.com/title/tt0978762/?pf_rd_m=A2FGELUUNOQJNL&pf_rd_p=e31d89dd-322d-4646-8962-327b42fe94b1&pf_rd_r=RHFMPC8Y06M9ZGESJ2JN&pf_rd_s=center-1&pf_rd_t=15506&pf_rd_i=top&ref_=chttp_tt_176
How to Train Your Dragon,"    Long ago up North on the Island of Berk, the young Viking, Hiccup, wants to join his town's fight against the dragons that continually raid their town. However, his macho father and village leader, Stoik the Vast, will not allow his small, clumsy, but inventive son to do so. Regardless, Hiccup ventures out into battle and downs a mysterious Night Fury dragon with his invention, but can't bring himself to kill it. Instead, Hiccup and the dragon, whom he dubs Toothless, begin a friendship that would open up both their worlds as the observant boy learns that his people have misjudged the species. But even as the two each take flight in their own way, they find that they must fight the destructive ignorance plaguing their world.",Animation," $217,581,231",https://www.imdb.com/title/tt0892769/?pf_rd_m=A2FGELUUNOQJNL&pf_rd_p=e31d89dd-322d-4646-8962-327b42fe94b1&pf_rd_r=RHFMPC8Y06M9ZGESJ2JN&pf_rd_s=center-1&pf_rd_t=15506&pf_rd_i=top&ref_=chttp_tt_177
Gone Girl,"    On the occasion of his fifth wedding anniversary, Nick Dunne reports that his wife, Amy, has gone missing. Under pressure from the police and a growing media frenzy, Nick's portrait of a blissful union begins to crumble. Soon his lies, deceits and strange behavior have everyone asking the same dark question: Did Nick Dunne kill his wife?",Crime," $37,513,109",https://www.imdb.com/title/tt2267998/?pf_rd_m=A2FGELUUNOQJNL&pf_rd_p=e31d89dd-322d-4646-8962-327b42fe94b1&pf_rd_r=RHFMPC8Y06M9ZGESJ2JN&pf_rd_s=center-1&pf_rd_t=15506&pf_rd_i=top&ref_=chttp_tt_178
Eskiya,"    The epic adventures of the legendary Baran the Bandit following his release from prison. After serving 35 years, it is no surprise that the world has changed dramatically. Still, Baran can't help but be shocked to discover that his home village is now underwater thanks to the construction of a new dam. He then heads for Istanbul to get revenge upon his former best friend, the man who snitched on him and stole his lover Keje. Along the way, Baran teams up with Cumali, a tough young punk who finds the thief's old-fashioned ways rather quaint. When Cumali gets into deep trouble with a crime boss, Baran adds another vengeful task to his roster.",Crime,,https://www.imdb.com/title/tt0116231/?pf_rd_m=A2FGELUUNOQJNL&pf_rd_p=e31d89dd-322d-4646-8962-327b42fe94b1&pf_rd_r=RHFMPC8Y06M9ZGESJ2JN&pf_rd_s=center-1&pf_rd_t=15506&pf_rd_i=top&ref_=chttp_tt_179
Relatos salvajes,"    The film is divided into six segments. (1) ""Pasternak"": While being on a plane, a model and a music critic realise they have a common acquaintance called Pasternak. Soon they discover that every passenger and crew member on board know Pasternak. Is this coincidence? (2) ""The Rats"": A waitress recognizes her client - it's the loan shark who caused a tragedy in her family. The cook suggests mixing rat poison with his food, but the waitress refuses. The stubborn cook, however, decides to proceed with her plan. (3) ""The Strongest"": Two drivers on a lone highway have an argument with tragic consequences. (4) ""Little Bomb"": A demolition engineer has his car towed by a truck for parking in a wrong place and he has an argument with the employee of the towing company. This event destroys his private and professional life, and he plots revenge against the corrupt towing company and the city hall. (5) ""The Proposal"": A reckless son of a wealthy family has an overnight hit-and-run accident, in ...",Comedy," $85,100",https://www.imdb.com/title/tt3011894/?pf_rd_m=A2FGELUUNOQJNL&pf_rd_p=e31d89dd-322d-4646-8962-327b42fe94b1&pf_rd_r=RHFMPC8Y06M9ZGESJ2JN&pf_rd_s=center-1&pf_rd_t=15506&pf_rd_i=top&ref_=chttp_tt_180
Into the Wild,"    Based on a true story. After graduating from Emory University, Christopher McCandless abandoned his possessions, gave his entire savings account to charity, and hitchhiked to Alaska to live in the wilderness. Along the way, Christopher encounters a series of characters who shape his life.",Adventure," $212,440",https://www.imdb.com/title/tt0758758/?pf_rd_m=A2FGELUUNOQJNL&pf_rd_p=e31d89dd-322d-4646-8962-327b42fe94b1&pf_rd_r=RHFMPC8Y06M9ZGESJ2JN&pf_rd_s=center-1&pf_rd_t=15506&pf_rd_i=top&ref_=chttp_tt_181
Life of Brian,"    The story of Brian of Nazareth, born on the same day as Jesus of Nazareth, who takes a different path in life that leads to the same conclusion. Brian joins a political resistance movement aiming to get the Romans out of Judea. Brian scores a victory of sorts when he manages to paint political slogans on an entire wall in the city of Jerusalem. The movement is not very effective but somehow Brian becomes a prophet and gathers his own following. His fate is sealed however and he lives a very short life.",Comedy," $20,045",https://www.imdb.com/title/tt0079470/?pf_rd_m=A2FGELUUNOQJNL&pf_rd_p=e31d89dd-322d-4646-8962-327b42fe94b1&pf_rd_r=RHFMPC8Y06M9ZGESJ2JN&pf_rd_s=center-1&pf_rd_t=15506&pf_rd_i=top&ref_=chttp_tt_182
Andrei Rublev,"    Andreiv Rublev charts the life of the great icon painter through a turbulent period of 15th Century Russian history, a period marked by endless fighting between rival Princes and by Tatar invasions.",Biography,,https://www.imdb.com/title/tt0060107/?pf_rd_m=A2FGELUUNOQJNL&pf_rd_p=e31d89dd-322d-4646-8962-327b42fe94b1&pf_rd_r=RHFMPC8Y06M9ZGESJ2JN&pf_rd_s=center-1&pf_rd_t=15506&pf_rd_i=top&ref_=chttp_tt_183
It Happened One Night,"    Ellie Andrews has just tied the knot with society aviator King Westley when she is whisked away to her father's yacht and out of King's clutches. Ellie jumps ship and eventually winds up on a bus headed back to her husband. Reluctantly she must accept the help of out-of- work reporter Peter Warne. Actually, Warne doesn't give her any choice: either she sticks with him until he gets her back to her husband, or he'll blow the whistle on Ellie to her father. Either way, Peter gets what (he thinks!) he wants .... a really juicy newspaper story.",Comedy,,https://www.imdb.com/title/tt0025316/?pf_rd_m=A2FGELUUNOQJNL&pf_rd_p=e31d89dd-322d-4646-8962-327b42fe94b1&pf_rd_r=RHFMPC8Y06M9ZGESJ2JN&pf_rd_s=center-1&pf_rd_t=15506&pf_rd_i=top&ref_=chttp_tt_184
Platoon,"    Chris Taylor is a young, naive American who gives up college and volunteers for combat in Vietnam. Upon arrival, he quickly discovers that his presence is quite nonessential, and is considered insignificant to the other soldiers, as he has not fought for as long as the rest of them and felt the effects of combat. Chris has two non-commissioned officers, the ill-tempered and indestructible Staff Sergeant Robert Barnes and the more pleasant and cooperative Sergeant Elias Grodin. A line is drawn between the two NCOs and a number of men in the platoon when an illegal killing occurs during a village raid. As the war continues, Chris himself draws towards psychological meltdown. And as he struggles for survival, he soon realizes he is fighting two battles, the conflict with the enemy and the conflict between the men within his platoon.",Drama," $241,080",https://www.imdb.com/title/tt0091763/?pf_rd_m=A2FGELUUNOQJNL&pf_rd_p=e31d89dd-322d-4646-8962-327b42fe94b1&pf_rd_r=RHFMPC8Y06M9ZGESJ2JN&pf_rd_s=center-1&pf_rd_t=15506&pf_rd_i=top&ref_=chttp_tt_185
In the Name of the Father,"    Young Belfastian Gerry Conlon admits that he was in London at the time of the incident. He also admits that he is not a model citizen, having committed a petty robbery while in London. He does however profess his innocence when it comes to the bombing of the Guildford Pub in London in 1974, the event which killed several people inside. A self-professed non-political person, he and his three co-accused, dubbed the Guildford Four, are thought to be provisional members of the IRA. Their self-professed innocence is despite each having signed a statement of guilt which they claim were signed under duress. Their case includes having provable alibis for the time frame of the bombing. And eventually, Joe McAndrew, a known IRA member, admits to the bombing. Dubbed the Maguire Seven, seven others, primarily members of Gerry's extended family including his father Giuseppe, are accused of being accessories to the bombing. Following on the work initiated by Giuseppe, Gerry works on a campaign to ...",Biography," $40,700,000",https://www.imdb.com/title/tt0107207/?pf_rd_m=A2FGELUUNOQJNL&pf_rd_p=e31d89dd-322d-4646-8962-327b42fe94b1&pf_rd_r=RHFMPC8Y06M9ZGESJ2JN&pf_rd_s=center-1&pf_rd_t=15506&pf_rd_i=top&ref_=chttp_tt_186
Jurassic Park,"    Huge advancements in scientific technology have enabled a mogul to create an island full of living dinosaurs. John Hammond has invited four individuals, along with his two grandchildren, to join him at Jurassic Park. But will everything go according to plan? A park employee attempts to steal dinosaur embryos, critical security systems are shut down and it now becomes a race for survival with dinosaurs roaming freely over the island.",Adventure," $50,159,460",https://www.imdb.com/title/tt0107290/?pf_rd_m=A2FGELUUNOQJNL&pf_rd_p=e31d89dd-322d-4646-8962-327b42fe94b1&pf_rd_r=RHFMPC8Y06M9ZGESJ2JN&pf_rd_s=center-1&pf_rd_t=15506&pf_rd_i=top&ref_=chttp_tt_187
