Title,Plot Summary,Genre,Box-Office Collection,URL
Mononoke-hime,"    While protecting his village from rampaging boar-god/demon, a confident young warrior, Ashitaka, is stricken by a deadly curse. To save his life, he must journey to the forests of the west. Once there, he's embroiled in a fierce campaign that humans were waging on the forest. The ambitious Lady Eboshi and her loyal clan use their guns against the gods of the forest and a brave young woman, Princess Mononoke, who was raised by a wolf-god. Ashitaka sees the good in both sides and tries to stem the flood of blood. This is met by animosity by both sides as they each see him as supporting the enemy.",Animation," $2,375",https://www.imdb.com/title/tt0119698/?pf_rd_m=A2FGELUUNOQJNL&pf_rd_p=e31d89dd-322d-4646-8962-327b42fe94b1&pf_rd_r=RHFMPC8Y06M9ZGESJ2JN&pf_rd_s=center-1&pf_rd_t=15506&pf_rd_i=top&ref_=chttp_tt_64
American Beauty,"    After his death sometime in his forty-third year, suburbanite Lester Burnham tells of the last few weeks of his life, during which he had no idea of his imminent passing. He is a husband to real estate agent Carolyn Burnham and father to high school student Janie Burnham. Although Lester and Carolyn once loved each other, they now merely tolerate each other. Typical wallflower Janie too hates both her parents, the three who suffer individually in silence in their home life. Janie tries to steer clear of both her parents. Carolyn, relatively new to the real estate business, wants to create the persona of success to further her career, she aspiring to the professional life of Buddy Kane, the king of the real estate business in their neighborhood. Lester merely walks mindlessly through life, including at his job in advertising. His company is downsizing, and he, like all the other employees, has to justify his position to the newly hired efficiency expert to keep his job. Things change ...",Drama," $861,531",https://www.imdb.com/title/tt0169547/?pf_rd_m=A2FGELUUNOQJNL&pf_rd_p=e31d89dd-322d-4646-8962-327b42fe94b1&pf_rd_r=RHFMPC8Y06M9ZGESJ2JN&pf_rd_s=center-1&pf_rd_t=15506&pf_rd_i=top&ref_=chttp_tt_65
The Dark Knight Rises,"    Despite his tarnished reputation after the events of The Dark Knight, in which he took the rap for Dent's crimes, Batman feels compelled to intervene to assist the city and its police force which is struggling to cope with Bane's plans to destroy the city.",Action," £14,362",https://www.imdb.com/title/tt1345836/?pf_rd_m=A2FGELUUNOQJNL&pf_rd_p=e31d89dd-322d-4646-8962-327b42fe94b1&pf_rd_r=RHFMPC8Y06M9ZGESJ2JN&pf_rd_s=center-1&pf_rd_t=15506&pf_rd_i=top&ref_=chttp_tt_66
Witness for the Prosecution,"    It's Britain, 1953. Upon his return to work following a heart attack, irrepressible barrister Sir Wilfrid Robarts, known as a barrister for the hopeless, takes on a murder case, much to the exasperation of his medical team, led by his overly regulated private nurse, Miss Plimsoll, who tries her hardest to ensure that he not return to his hard living ways - including excessive cigar smoking and drinking - while he takes his medication and gets his much needed rest. That case is defending American war veteran Leonard Vole, a poor, out of work, struggling inventor who is accused of murdering his fifty-six year old lonely and wealthy widowed acquaintance, Emily French. The initial evidence is circumstantial but points to Leonard as the murderer. Despite being happily married to East German former beer hall performer Christine Vole, he fostered that friendship with Mrs. French in the hopes that she would finance one of his many inventions to the tune of a few hundred pounds. It thus does ...",Crime,,https://www.imdb.com/title/tt0051201/?pf_rd_m=A2FGELUUNOQJNL&pf_rd_p=e31d89dd-322d-4646-8962-327b42fe94b1&pf_rd_r=RHFMPC8Y06M9ZGESJ2JN&pf_rd_s=center-1&pf_rd_t=15506&pf_rd_i=top&ref_=chttp_tt_67
Oldeuboi,"    Abducted on a rainy night in 1988, the obnoxious drunk, Oh Dae-Su, much to his surprise, wakes up locked in a windowless and dilapidated hotel room, for an unknown reason. There, his invisible and pitiless captors will feed him, clothe him and sedate him to avoid committing suicide, and as his only companion and a window to the world is the TV in his stark cell, the only thing that helps Oh Dae-Su keep going is his daily journal. But then, unexpectedly, after fifteen long years in captivity, the perplexed prisoner is deliberately released, encouraged to track down his tormentor to finally get his retribution. Nevertheless, who would hate Oh Dae-Su so much he would deny him of a quick and clean death?",Action," $68,957",https://www.imdb.com/title/tt0364569/?pf_rd_m=A2FGELUUNOQJNL&pf_rd_p=e31d89dd-322d-4646-8962-327b42fe94b1&pf_rd_r=RHFMPC8Y06M9ZGESJ2JN&pf_rd_s=center-1&pf_rd_t=15506&pf_rd_i=top&ref_=chttp_tt_68
Aliens,"    57 years after Ellen Ripley had a close encounter with the reptilian alien creature from the first movie, she is called back, this time, to help a group of highly trained colonial marines fight off against the sinister extraterrestrials. But this time, the aliens have taken over a space colony on the moon LV-426. When the colonial marines are called upon to search the deserted space colony, they later find out that they are up against more than what they bargained for. Using specially modified machine guns and enough firepower, it's either fight or die as the space marines battle against the aliens. As the Marines do their best to defend themselves, Ripley must attempt to protect a young girl who is the sole survivor of the decimated space colony.",Action," $10,052,042",https://www.imdb.com/title/tt0090605/?pf_rd_m=A2FGELUUNOQJNL&pf_rd_p=e31d89dd-322d-4646-8962-327b42fe94b1&pf_rd_r=RHFMPC8Y06M9ZGESJ2JN&pf_rd_s=center-1&pf_rd_t=15506&pf_rd_i=top&ref_=chttp_tt_69
Once Upon a Time in America,"    Epic tale of a group of Jewish gangsters in New York, from childhood, through their glory years during prohibition, and their meeting again 35 years later.",Crime," $5,321",https://www.imdb.com/title/tt0087843/?pf_rd_m=A2FGELUUNOQJNL&pf_rd_p=e31d89dd-322d-4646-8962-327b42fe94b1&pf_rd_r=RHFMPC8Y06M9ZGESJ2JN&pf_rd_s=center-1&pf_rd_t=15506&pf_rd_i=top&ref_=chttp_tt_70
Das Boot,"    It is 1942 and the German submarine fleet is heavily engaged in the so-called ""Battle of the Atlantic"" to harass and destroy British shipping. With better escorts of the destroyer class, however, German U-boats have begun to take heavy losses. ""Das Boot"" is the story of the crew of one such U-Boat, with the film examining how these submariners maintained their professionalism as soldiers and attempted to accomplish impossible missions, all the while attempting to understand and obey the ideology of the government under which they served.",Adventure," $26,994",https://www.imdb.com/title/tt0082096/?pf_rd_m=A2FGELUUNOQJNL&pf_rd_p=e31d89dd-322d-4646-8962-327b42fe94b1&pf_rd_r=RHFMPC8Y06M9ZGESJ2JN&pf_rd_s=center-1&pf_rd_t=15506&pf_rd_i=top&ref_=chttp_tt_71
Citizen Kane,"    A group of reporters are trying to decipher the last word ever spoken by Charles Foster Kane, the millionaire newspaper tycoon: ""Rosebud"". The film begins with a news reel detailing Kane's life for the masses, and then from there, we are shown flashbacks from Kane's life. As the reporters investigate further, the viewers see a display of a fascinating man's rise to fame, and how he eventually fell off the top of the world.",Drama," $216,239",https://www.imdb.com/title/tt0033467/?pf_rd_m=A2FGELUUNOQJNL&pf_rd_p=e31d89dd-322d-4646-8962-327b42fe94b1&pf_rd_r=RHFMPC8Y06M9ZGESJ2JN&pf_rd_s=center-1&pf_rd_t=15506&pf_rd_i=top&ref_=chttp_tt_72
Vertigo,"    John ""Scottie"" Ferguson is a retired San Francisco police detective who suffers from acrophobia and Madeleine is the lady who leads him to high places. A wealthy shipbuilder who is an acquaintance from college days approaches Scottie and asks him to follow his beautiful wife, Madeleine. He fears she is going insane, maybe even contemplating suicide, he believes she is possessed by a dead ancestor. Scottie is skeptical, but agrees after he sees the beautiful Madeleine.",Mystery," $3,200",https://www.imdb.com/title/tt0052357/?pf_rd_m=A2FGELUUNOQJNL&pf_rd_p=e31d89dd-322d-4646-8962-327b42fe94b1&pf_rd_r=RHFMPC8Y06M9ZGESJ2JN&pf_rd_s=center-1&pf_rd_t=15506&pf_rd_i=top&ref_=chttp_tt_73
North by Northwest,"    Madison Avenue advertising man Roger Thornhill finds himself thrust into the world of spies when he is mistaken for a man by the name of George Kaplan. Foreign spy Philip Vandamm and his henchman Leonard try to eliminate him but when Thornhill tries to make sense of the case, he is framed for murder. Now on the run from the police, he manages to board the 20th Century Limited bound for Chicago where he meets a beautiful blond, Eve Kendall, who helps him to evade the authorities. His world is turned upside down yet again when he learns that Eve isn't the innocent bystander he thought she was. Not all is as it seems however, leading to a dramatic rescue and escape at the top of Mt. Rushmore.",Adventure," $22,213",https://www.imdb.com/title/tt0053125/?pf_rd_m=A2FGELUUNOQJNL&pf_rd_p=e31d89dd-322d-4646-8962-327b42fe94b1&pf_rd_r=RHFMPC8Y06M9ZGESJ2JN&pf_rd_s=center-1&pf_rd_t=15506&pf_rd_i=top&ref_=chttp_tt_74
Braveheart,"    William Wallace is a Scottish rebel who leads an uprising against the cruel English ruler Edward the Longshanks, who wishes to inherit the crown of Scotland for himself. When he was a young boy, William Wallace's father and brother, along with many others, lost their lives trying to free Scotland. Once he loses another of his loved ones, William Wallace begins his long quest to make Scotland free once and for all, along with the assistance of Robert the Bruce.",Biography," $9,938,276",https://www.imdb.com/title/tt0112573/?pf_rd_m=A2FGELUUNOQJNL&pf_rd_p=e31d89dd-322d-4646-8962-327b42fe94b1&pf_rd_r=RHFMPC8Y06M9ZGESJ2JN&pf_rd_s=center-1&pf_rd_t=15506&pf_rd_i=top&ref_=chttp_tt_75
Reservoir Dogs,"    Six criminals, who are strangers to each other, are hired by a crime boss, Joe Cabot, to carry out a diamond robbery. Right at the outset, they are given false names with the intention that they won't get too close and will concentrate on the job instead. They are completely sure that the robbery is going to be a success. But, when the police show up right at the time and the site of the robbery, panic spreads amongst the group members, and two of them are killed in the subsequent shootout, along with a few policemen and civilians. When the remaining people assemble at the premeditated rendezvous point (a warehouse), they begin to suspect that one of them is an undercover cop.",Crime," $147,839",https://www.imdb.com/title/tt0105236/?pf_rd_m=A2FGELUUNOQJNL&pf_rd_p=e31d89dd-322d-4646-8962-327b42fe94b1&pf_rd_r=RHFMPC8Y06M9ZGESJ2JN&pf_rd_s=center-1&pf_rd_t=15506&pf_rd_i=top&ref_=chttp_tt_76
Star Wars: Episode VI - Return of the Jedi,"    Luke Skywalker battles horrible Jabba the Hut and cruel Darth Vader to save his comrades in the Rebel Alliance and triumph over the Galactic Empire. Han Solo and Princess Leia reaffirm their love and team with Chewbacca, Lando Calrissian, the Ewoks and the androids C-3PO and R2-D2 to aid in the disruption of the Dark Side and the defeat of the evil emperor.",Action," $30,490,619",https://www.imdb.com/title/tt0086190/?pf_rd_m=A2FGELUUNOQJNL&pf_rd_p=e31d89dd-322d-4646-8962-327b42fe94b1&pf_rd_r=RHFMPC8Y06M9ZGESJ2JN&pf_rd_s=center-1&pf_rd_t=15506&pf_rd_i=top&ref_=chttp_tt_77
Kimi no na wa.,    Mitsuha is the daughter of the mayor of a small mountain town. She's a straightforward high school girl who lives with her sister and her grandmother and has no qualms about letting it be known that she's uninterested in Shinto rituals or helping her father's electoral campaign. Instead she dreams of leaving the boring town and trying her luck in Tokyo. Taki is a high school boy in Tokyo who works part-time in an Italian restaurant and aspires to become an architect or an artist. Every night he has a strange dream where he becomes...a high school girl in a small mountain town.,Animation," $357,986",https://www.imdb.com/title/tt5311514/?pf_rd_m=A2FGELUUNOQJNL&pf_rd_p=e31d89dd-322d-4646-8962-327b42fe94b1&pf_rd_r=RHFMPC8Y06M9ZGESJ2JN&pf_rd_s=center-1&pf_rd_t=15506&pf_rd_i=top&ref_=chttp_tt_78
M - Eine Stadt sucht einen Mörder,"    In Germany, Hans Beckert is an unknown killer of girls. He whistles Edvard Grieg's 'In The Hall of the Mountain King', from the 'Peer Gynt' Suite I Op. 46 while attracting the little girls for death. The police force pressed by the Minister give its best effort trying unsuccessfully to arrest the serial killer. The organized crime has great losses due to the intense search and siege of the police and decides to chase the murderer, with the support of the beggars association. They catch Hans and briefly judge him.",Crime,,https://www.imdb.com/title/tt0022100/?pf_rd_m=A2FGELUUNOQJNL&pf_rd_p=e31d89dd-322d-4646-8962-327b42fe94b1&pf_rd_r=RHFMPC8Y06M9ZGESJ2JN&pf_rd_s=center-1&pf_rd_t=15506&pf_rd_i=top&ref_=chttp_tt_79
Dangal,"    Biopic of Mahavir Singh Phogat, who taught wrestling to his daughters Babita Kumari and Geeta Phogat. Geeta Phogat was India's first female wrestler to win at the 2010 Commonwealth Games, where she won the gold medal (55 kg) while her sister Babita Kumari won the silver (51 kg).",Action," INR 1,497,300",https://www.imdb.com/title/tt5074352/?pf_rd_m=A2FGELUUNOQJNL&pf_rd_p=e31d89dd-322d-4646-8962-327b42fe94b1&pf_rd_r=RHFMPC8Y06M9ZGESJ2JN&pf_rd_s=center-1&pf_rd_t=15506&pf_rd_i=top&ref_=chttp_tt_80
Requiem for a Dream,"    Sara Goldfarb (Ellen Burstyn) is a retired widow, living in a small apartment. She spends most of her time watching TV, especially a particular self-help show. She has delusions of rising above her current dull existence by being a guest on that show. Her son, Harry (Jared Leto) is a junkie but along with his friend Tyrone (Marlon Wayans) has visions of making it big by becoming a drug dealer. Harry's girlfriend Marion (Jennifer Connelly) could be fashion designer or artist but is swept along in Harry's drug-centric world. Meanwhile Sara has developed an addiction of her own. She desperately wants to lose weight and so goes on a crash course involving popping pills, pills which turn out to be very addictive and harmful to her mental state.",Drama," $3,635",https://www.imdb.com/title/tt0180093/?pf_rd_m=A2FGELUUNOQJNL&pf_rd_p=e31d89dd-322d-4646-8962-327b42fe94b1&pf_rd_r=RHFMPC8Y06M9ZGESJ2JN&pf_rd_s=center-1&pf_rd_t=15506&pf_rd_i=top&ref_=chttp_tt_81
Amadeus," Antonio Salieri believes that Wolfgang Amadeus Mozart's music is divine and miraculous. He wishes he was himself as good a musician as Mozart so that he can praise the Lord through composing. He began his career as a devout man who believes his success and talent as a composer are God's rewards for his piety. He's also content as the respected, financially well-off, court composer of Austrian Emperor Joseph II. But he's shocked to learn that Mozart is such a vulgar creature, and can't understand why God favored Mozart to be his instrument. Salieri's envy has made him an enemy of God whose greatness was evident in Mozart. He is ready to take revenge against God and Mozart for his own musical mediocrity.",Biography," $505,276",https://www.imdb.com/title/tt0086879/?pf_rd_m=A2FGELUUNOQJNL&pf_rd_p=e31d89dd-322d-4646-8962-327b42fe94b1&pf_rd_r=RHFMPC8Y06M9ZGESJ2JN&pf_rd_s=center-1&pf_rd_t=15506&pf_rd_i=top&ref_=chttp_tt_82
Taare Zameen Par,"    Ishaan Awasthi is an eight-year-old child whose world is filled with wonders that no one else seems to appreciate; colours, fish, dogs and kites are just not important in the world of adults, who are much more interested in things like homework, marks and neatness. And Ishaan just cannot seem to get anything right in class. When he gets into far more trouble than his parents can handle, he is packed off to a boarding school to 'be disciplined'. Things are no different at his new school, and Ishaan has to contend with the added trauma of separation from his family. One day a new art teacher bursts onto the scene, Ram Shankar Nikumbh, who infects the students with joy and optimism. He breaks all the rules of 'how things are done' by asking them to think, dream and imagine, and all the children respond with enthusiasm, all except Ishaan. Nikumbh soon realizes that Ishaan is very unhappy, and he sets out to discover why. With time, patience and care, he ultimately helps Ishaan find ...",Drama," $1,204,660",https://www.imdb.com/title/tt0986264/?pf_rd_m=A2FGELUUNOQJNL&pf_rd_p=e31d89dd-322d-4646-8962-327b42fe94b1&pf_rd_r=RHFMPC8Y06M9ZGESJ2JN&pf_rd_s=center-1&pf_rd_t=15506&pf_rd_i=top&ref_=chttp_tt_83
Amélie,"    Amélie is a story about a girl named Amélie whose childhood was suppressed by her Father's mistaken concerns of a heart defect. With these concerns Amélie gets hardly any real life contact with other people. This leads Amélie to resort to her own fantastical world and dreams of love and beauty. She later on becomes a young woman and moves to the central part of Paris as a waitress. After finding a lost treasure belonging to the former occupant of her apartment, she decides to return it to him. After seeing his reaction and his new found perspective - she decides to devote her life to the people around her. Such as, her father who is obsessed with his garden-gnome, a failed writer, a hypochondriac, a man who stalks his ex girlfriends, the ""ghost"", a suppressed young soul, the love of her life and a man whose bones are as brittle as glass. But after consuming herself with these escapades - she finds out that she is disregarding her own life and damaging her quest for love. Amélie then ...",Comedy, $496,https://www.imdb.com/title/tt0211915/?pf_rd_m=A2FGELUUNOQJNL&pf_rd_p=e31d89dd-322d-4646-8962-327b42fe94b1&pf_rd_r=RHFMPC8Y06M9ZGESJ2JN&pf_rd_s=center-1&pf_rd_t=15506&pf_rd_i=top&ref_=chttp_tt_84
A Clockwork Orange,"    Protagonist Alex DeLarge is an ""ultraviolent"" youth in futuristic Britain. As with all luck, his eventually runs out and he's arrested and convicted of murder and rape. While in prison, Alex learns of an experimental program in which convicts are programmed to detest violence. If he goes through the program, his sentence will be reduced and he will be back on the streets sooner than expected. But Alex's ordeals are far from over once he hits the mean streets of Britain that he had a hand in creating.",Crime," $26,589,355",https://www.imdb.com/title/tt0066921/?pf_rd_m=A2FGELUUNOQJNL&pf_rd_p=e31d89dd-322d-4646-8962-327b42fe94b1&pf_rd_r=RHFMPC8Y06M9ZGESJ2JN&pf_rd_s=center-1&pf_rd_t=15506&pf_rd_i=top&ref_=chttp_tt_85
Lawrence of Arabia,"    Due to his knowledge of the native Bedouin tribes, British Lieutenant T.E. Lawrence is sent to Arabia to find Prince Faisal and serve as a liaison between the Arabs and the British in their fight against the Turks. With the aid of native Sherif Ali, Lawrence rebels against the orders of his superior officer and strikes out on a daring camel journey across the harsh desert to attack a well-guarded Turkish port.",Adventure," $20,846",https://www.imdb.com/title/tt0056172/?pf_rd_m=A2FGELUUNOQJNL&pf_rd_p=e31d89dd-322d-4646-8962-327b42fe94b1&pf_rd_r=RHFMPC8Y06M9ZGESJ2JN&pf_rd_s=center-1&pf_rd_t=15506&pf_rd_i=top&ref_=chttp_tt_86
Eternal Sunshine of the Spotless Mind,"    A man, Joel Barish, heartbroken that his girlfriend Clementine underwent a procedure to erase him from her memory, decides to do the same. However, as he watches his memories of her fade away, he realizes that he still loves her, and may be too late to correct his mistake.",Drama," $8,175,198",https://www.imdb.com/title/tt0338013/?pf_rd_m=A2FGELUUNOQJNL&pf_rd_p=e31d89dd-322d-4646-8962-327b42fe94b1&pf_rd_r=RHFMPC8Y06M9ZGESJ2JN&pf_rd_s=center-1&pf_rd_t=15506&pf_rd_i=top&ref_=chttp_tt_87
Double Indemnity,"    In 1938, Walter Neff, an experienced salesman of the Pacific All Risk Insurance Co., meets the seductive wife of one of his clients, Phyllis Dietrichson, and they have an affair. Phyllis proposes to kill her husband to receive the proceeds of an accident insurance policy and Walter devises a scheme to receive twice the amount based on a double indemnity clause. When Mr. Dietrichson is found dead on a train track, the police accept the determination of accidental death. However, the insurance analyst and Walter's best friend Barton Keyes does not buy the story and suspects that Phyllis has murdered her husband with the help of another man.",Crime," $5,720,000",https://www.imdb.com/title/tt0036775/?pf_rd_m=A2FGELUUNOQJNL&pf_rd_p=e31d89dd-322d-4646-8962-327b42fe94b1&pf_rd_r=RHFMPC8Y06M9ZGESJ2JN&pf_rd_s=center-1&pf_rd_t=15506&pf_rd_i=top&ref_=chttp_tt_88
Taxi Driver,"    Travis Bickle is an ex-Marine and Vietnam War veteran living in New York City. As he suffers from insomnia, he spends his time working as a taxi driver at night, watching porn movies at seedy cinemas during the day, or thinking about how the world, New York in particular, has deteriorated into a cesspool. He's a loner who has strong opinions about what is right and wrong with mankind. For him, the one bright spot in New York humanity is Betsy, a worker on the presidential nomination campaign of Senator Charles Palantine. He becomes obsessed with her. After an incident with her, he believes he has to do whatever he needs to make the world a better place in his opinion. One of his priorities is to be the savior for Iris, a twelve-year-old runaway and prostitute who he believes wants out of the profession and under the thumb of her pimp and lover Matthew.",Crime,,https://www.imdb.com/title/tt0075314/?pf_rd_m=A2FGELUUNOQJNL&pf_rd_p=e31d89dd-322d-4646-8962-327b42fe94b1&pf_rd_r=RHFMPC8Y06M9ZGESJ2JN&pf_rd_s=center-1&pf_rd_t=15506&pf_rd_i=top&ref_=chttp_tt_89
2001: A Space Odyssey,"    ""2001"" is a story of evolution. Sometime in the distant past, someone or something nudged evolution by placing a monolith on Earth (presumably elsewhere throughout the universe as well). Evolution then enabled humankind to reach the moon's surface, where yet another monolith is found, one that signals the monolith placers that humankind has evolved that far. Now a race begins between computers (HAL) and human (Bowman) to reach the monolith placers. The winner will achieve the next step in evolution, whatever that may be.",Adventure, £69,https://www.imdb.com/title/tt0062622/?pf_rd_m=A2FGELUUNOQJNL&pf_rd_p=e31d89dd-322d-4646-8962-327b42fe94b1&pf_rd_r=RHFMPC8Y06M9ZGESJ2JN&pf_rd_s=center-1&pf_rd_t=15506&pf_rd_i=top&ref_=chttp_tt_90
3 Idiots,"    Farhan Qureshi and Raju Rastogi want to re-unite with their fellow collegian, Rancho, after faking a stroke aboard an Air India plane, and excusing himself from his wife - trouser less - respectively. Enroute, they encounter another student, Chatur Ramalingam, now a successful businessman, who reminds them of a bet they had undertaken 10 years ago. The trio, while recollecting hilarious antics, including their run-ins with the Dean of Delhi's Imperial College of Engineering, Viru Sahastrabudhe, race to locate Rancho, at his last known address - little knowing the secret that was kept from them all this time.",Comedy," $6,532,908",https://www.imdb.com/title/tt1187043/?pf_rd_m=A2FGELUUNOQJNL&pf_rd_p=e31d89dd-322d-4646-8962-327b42fe94b1&pf_rd_r=RHFMPC8Y06M9ZGESJ2JN&pf_rd_s=center-1&pf_rd_t=15506&pf_rd_i=top&ref_=chttp_tt_91
Singin' in the Rain,"    1927 Hollywood. Monumental Pictures' biggest stars, glamorous on-screen couple Lina Lamont and Don Lockwood, are also an off-screen couple if the trade papers and gossip columns are to be believed. Both perpetuate the public perception if only to please their adoring fans and bring people into the movie theaters. In reality, Don barely tolerates her, while Lina, despite thinking Don beneath her, simplemindedly believes what she sees on screen in order to bolster her own stardom and sense of self-importance. R.F. Simpson, Monumental's head, dismisses what he thinks is a flash in the pan: talking pictures. It isn't until The Jazz Singer (1927) becomes a bona fide hit which results in all the movie theaters installing sound equipment that R.F. knows Monumental, most specifically in the form of Don and Lina, have to jump on the talking picture bandwagon, despite no one at the studio knowing anything about the technology. Musician Cosmo Brown, Don's best friend, gets hired as Monumental's ...",Comedy," $13,979",https://www.imdb.com/title/tt0045152/?pf_rd_m=A2FGELUUNOQJNL&pf_rd_p=e31d89dd-322d-4646-8962-327b42fe94b1&pf_rd_r=RHFMPC8Y06M9ZGESJ2JN&pf_rd_s=center-1&pf_rd_t=15506&pf_rd_i=top&ref_=chttp_tt_92
Toy Story,"    A little boy named Andy loves to be in his room, playing with his toys, especially his doll named ""Woody"". But, what do the toys do when Andy is not with them, they come to life. Woody believes that he has life (as a toy) good. However, he must worry about Andy's family moving, and what Woody does not know is about Andy's birthday party. Woody does not realize that Andy's mother gave him an action figure known as Buzz Lightyear, who does not believe that he is a toy, and quickly becomes Andy's new favorite toy. Woody, who is now consumed with jealousy, tries to get rid of Buzz. Then, both Woody and Buzz are now lost. They must find a way to get back to Andy before he moves without them, but they will have to pass through a ruthless toy killer, Sid Phillips.",Animation," $29,140,617",https://www.imdb.com/title/tt0114709/?pf_rd_m=A2FGELUUNOQJNL&pf_rd_p=e31d89dd-322d-4646-8962-327b42fe94b1&pf_rd_r=RHFMPC8Y06M9ZGESJ2JN&pf_rd_s=center-1&pf_rd_t=15506&pf_rd_i=top&ref_=chttp_tt_93
