Title,Plot Summary,Genre,Box-Office Collection,URL
Raging Bull,"    When Jake LaMotta steps into a boxing ring and obliterates his opponent, he's a prizefighter. But when he treats his family and friends the same way, he's a ticking time bomb, ready to go off at any moment. Though LaMotta wants his family's love, something always seems to come between them. Perhaps it's his violent bouts of paranoia and jealousy. This kind of rage helped make him a champ, but in real life, he winds up in the ring alone.",Biography," $49,034",https://www.imdb.com/title/tt0081398/?pf_rd_m=A2FGELUUNOQJNL&pf_rd_p=e31d89dd-322d-4646-8962-327b42fe94b1&pf_rd_r=RHFMPC8Y06M9ZGESJ2JN&pf_rd_s=center-1&pf_rd_t=15506&pf_rd_i=top&ref_=chttp_tt_124
Ikiru,"    Kanji Watanabe is a civil servant. He has worked in the same department for 30 years. His life is pretty boring and monotonous, though he once used to have passion and drive. Then one day he discovers that he has stomach cancer and has less than a year to live. After the initial depression he sets about living for the first time in over 20 years. Then he realises that his limited time left is not just for living life to the full but to leave something meaningful behind...",Drama,,https://www.imdb.com/title/tt0044741/?pf_rd_m=A2FGELUUNOQJNL&pf_rd_p=e31d89dd-322d-4646-8962-327b42fe94b1&pf_rd_r=RHFMPC8Y06M9ZGESJ2JN&pf_rd_s=center-1&pf_rd_t=15506&pf_rd_i=top&ref_=chttp_tt_125
The Great Escape,"    Based on a true story, a group of allied escape artist-type prisoners-of-war (POWs) are all put in an 'escape proof' camp. Their leader decides to try to take out several hundred all at once. The first half of the film is played for comedy as the prisoners mostly outwit their jailers to dig the escape tunnel. The second half is high adventure as they use boats and trains and planes to get out of occupied Europe.",Adventure,,https://www.imdb.com/title/tt0057115/?pf_rd_m=A2FGELUUNOQJNL&pf_rd_p=e31d89dd-322d-4646-8962-327b42fe94b1&pf_rd_r=RHFMPC8Y06M9ZGESJ2JN&pf_rd_s=center-1&pf_rd_t=15506&pf_rd_i=top&ref_=chttp_tt_126
The Third Man,"    An out of work pulp fiction novelist, Holly Martins, arrives in a post war Vienna divided into sectors by the victorious allies, and where a shortage of supplies has led to a flourishing black market. He arrives at the invitation of an ex-school friend, Harry Lime, who has offered him a job, only to discover that Lime has recently died in a peculiar traffic accident. From talking to Lime's friends and associates Martins soon notices that some of the stories are inconsistent, and determines to discover what really happened to Harry Lime.",Film-Noir," $449,191",https://www.imdb.com/title/tt0041959/?pf_rd_m=A2FGELUUNOQJNL&pf_rd_p=e31d89dd-322d-4646-8962-327b42fe94b1&pf_rd_r=RHFMPC8Y06M9ZGESJ2JN&pf_rd_s=center-1&pf_rd_t=15506&pf_rd_i=top&ref_=chttp_tt_127
Incendies,"    A mother's last wishes send twins Jeanne and Simon on a journey to the Middle East in search of their tangled roots. Adapted from Wajdi Mouawad's acclaimed play, Incendies tells the powerful and moving tale of two young adults' voyage to the core of deep-rooted hatred, never-ending wars and enduring love.",Drama, CAD 177,https://www.imdb.com/title/tt1255953/?pf_rd_m=A2FGELUUNOQJNL&pf_rd_p=e31d89dd-322d-4646-8962-327b42fe94b1&pf_rd_r=RHFMPC8Y06M9ZGESJ2JN&pf_rd_s=center-1&pf_rd_t=15506&pf_rd_i=top&ref_=chttp_tt_128
Bacheha-Ye aseman,"    Zahra's shoes are gone; her older brother Ali lost them. They are poor, there are no shoes for Zahra until they come up with an idea: they will share one pair of shoes, Ali's. School awaits. Will the plan succeed?",Drama," $20,100",https://www.imdb.com/title/tt0118849/?pf_rd_m=A2FGELUUNOQJNL&pf_rd_p=e31d89dd-322d-4646-8962-327b42fe94b1&pf_rd_r=RHFMPC8Y06M9ZGESJ2JN&pf_rd_s=center-1&pf_rd_t=15506&pf_rd_i=top&ref_=chttp_tt_129
Pan's Labyrinth,"    In 1944 falangist Spain, a girl, fascinated with fairy-tales, is sent along with her pregnant mother to live with her new stepfather, a ruthless captain of the Spanish army. During the night, she meets a fairy who takes her to an old faun in the center of the labyrinth. He tells her she's a princess, but must prove her royalty by surviving three gruesome tasks. If she fails, she will never prove herself to be the the true princess and will never see her real father, the king, again.",Drama," €1,545",https://www.imdb.com/title/tt0457430/?pf_rd_m=A2FGELUUNOQJNL&pf_rd_p=e31d89dd-322d-4646-8962-327b42fe94b1&pf_rd_r=RHFMPC8Y06M9ZGESJ2JN&pf_rd_s=center-1&pf_rd_t=15506&pf_rd_i=top&ref_=chttp_tt_130
Chinatown,"    In 1937 Los Angeles, private investigator Jake 'J.J.' Gittes specializes in cheating-spouse cases. His current target is Hollis Mulwray, high-profile chief engineer for the Los Angeles Department of Water and Power, whose wife suspects him of infidelity. In following Mulwray, Gittes witnesses some usual business dealings, such as a public meeting for construction of a new dam to create additional water supply for Los Angeles, as fresh water is vital to the growing community during the chronic drought; Mulwray opposes the dam. Eventually Gittes sees Mulwray meeting with an unknown young woman who isn't his wife. Once news of the supposed tryst between Mulwray and this woman hits the media, additional information comes to light that makes Gittes believe that Mulwray is being framed for something and that he himself is being set up. In his investigation of the issue behind Mulwray's framing and his own setup, Gittes is assisted by Mulwray's wife Evelyn, but he thinks she isn't being ...",Drama," $30,000,000",https://www.imdb.com/title/tt0071315/?pf_rd_m=A2FGELUUNOQJNL&pf_rd_p=e31d89dd-322d-4646-8962-327b42fe94b1&pf_rd_r=RHFMPC8Y06M9ZGESJ2JN&pf_rd_s=center-1&pf_rd_t=15506&pf_rd_i=top&ref_=chttp_tt_131
Tonari no Totoro,"    Two young girls, 10-year-old Satsuki and her 4-year-old sister Mei, move into a house in the country with their father to be closer to their hospitalized mother. Satsuki and Mei discover that the nearby forest is inhabited by magical creatures called Totoros (pronounced toe-toe-ro). They soon befriend these Totoros, and have several magical adventures.",Animation,,https://www.imdb.com/title/tt0096283/?pf_rd_m=A2FGELUUNOQJNL&pf_rd_p=e31d89dd-322d-4646-8962-327b42fe94b1&pf_rd_r=RHFMPC8Y06M9ZGESJ2JN&pf_rd_s=center-1&pf_rd_t=15506&pf_rd_i=top&ref_=chttp_tt_132
"Three Billboards Outside Ebbing, Missouri","    THREE BILLBOARDS OUTSIDE EBBING, MISSOURI is a darkly comic drama from Academy Award nominee Martin McDonagh (In Bruges). After months have passed without a culprit in her daughter's murder case, Mildred Hayes (Academy Award winner Frances McDormand) makes a bold move, painting three signs leading into her town with a controversial message directed at William Willoughby (Academy Award nominee Woody Harrelson), the town's revered chief of police. When his second-in-command Officer Dixon (Academy Award winner Sam Rockwell), an immature mother's boy with a penchant for violence, gets involved, the battle between Mildred and Ebbing's law enforcement is only exacerbated.",Crime," $322,168",https://www.imdb.com/title/tt5027774/?pf_rd_m=A2FGELUUNOQJNL&pf_rd_p=e31d89dd-322d-4646-8962-327b42fe94b1&pf_rd_r=RHFMPC8Y06M9ZGESJ2JN&pf_rd_s=center-1&pf_rd_t=15506&pf_rd_i=top&ref_=chttp_tt_133
Judgment at Nuremberg,"    It has been three years since the most important Nazi leaders had already been tried. This trial is about 4 judges who used their offices to conduct Nazi sterilization and cleansing policies. Retired American judge, Dan Haywood has a daunting task ahead of him. The Cold War is heating up and no one wants any more trials as Germany, and Allied governments, want to forget the past. But is that the right thing to do is the question that the tribunal must decide.",Drama," $10,000,000",https://www.imdb.com/title/tt0055031/?pf_rd_m=A2FGELUUNOQJNL&pf_rd_p=e31d89dd-322d-4646-8962-327b42fe94b1&pf_rd_r=RHFMPC8Y06M9ZGESJ2JN&pf_rd_s=center-1&pf_rd_t=15506&pf_rd_i=top&ref_=chttp_tt_134
Ran,"    Japanese warlord Hidetori Ichimonji decides the time has come to retire and divide his fiefdom among his three sons. His eldest and middle sons - Taro and Jiro - agree with his decision and promise to support him for his remaining days. The youngest son Saburo disagrees with all of them arguing that there is little likelihood the three brothers will remain united. Insulted by his son's brashness, the warlord banishes Saburo. As the warlord begins his retirement, he quickly realizes that his two eldest sons selfish and have no intention of keeping their promises. It leads to war and only banished Saburo can possibly save him.",Action," $3,522",https://www.imdb.com/title/tt0089881/?pf_rd_m=A2FGELUUNOQJNL&pf_rd_p=e31d89dd-322d-4646-8962-327b42fe94b1&pf_rd_r=RHFMPC8Y06M9ZGESJ2JN&pf_rd_s=center-1&pf_rd_t=15506&pf_rd_i=top&ref_=chttp_tt_135
El secreto de sus ojos,"    In 1999, retired Argentinian federal justice agent Benjamín Espósito is writing a novel, using an old closed case as the source material. That case is the brutal rape and murder of Liliana Coloto. In addition to seeing the extreme grief of the victim's husband Ricardo Morales, Benjamín, his assistant Pablo Sandoval, and newly hired department chief Irene Menéndez-Hastings were personally affected by the case as Benjamín and Pablo tracked the killer, hence the reason why the unsatisfactory ending to the case has always bothered him. Despite the department already having two other suspects, Benjamín and Pablo ultimately were certain that a man named Isidoro Gómez is the real killer. Although he is aware that historical accuracy is not paramount for the novel, the process of revisiting the case is more an issue of closure for him. He tries to speak to the key players in the case, most specifically Irene, who still works in the justice department and who he has always been attracted to ...",Drama," ARS 2,883",https://www.imdb.com/title/tt1305806/?pf_rd_m=A2FGELUUNOQJNL&pf_rd_p=e31d89dd-322d-4646-8962-327b42fe94b1&pf_rd_r=RHFMPC8Y06M9ZGESJ2JN&pf_rd_s=center-1&pf_rd_t=15506&pf_rd_i=top&ref_=chttp_tt_136
Hauru no ugoku shiro,"    A love story between an 18-year-old girl named Sophie, cursed by a witch into an old woman's body, and a magician named Howl. Under the curse, Sophie sets out to seek her fortune, which takes her to Howl's strange moving castle. In the castle, Sophie meets Howl's fire demon, named Karishifâ. Seeing that she is under a curse, the demon makes a deal with Sophie--if she breaks the contract he is under with Howl, then Karushifâ will lift the curse that Sophie is under, and she will return to her 18-year-old shape.",Animation," $427,987",https://www.imdb.com/title/tt0347149/?pf_rd_m=A2FGELUUNOQJNL&pf_rd_p=e31d89dd-322d-4646-8962-327b42fe94b1&pf_rd_r=RHFMPC8Y06M9ZGESJ2JN&pf_rd_s=center-1&pf_rd_t=15506&pf_rd_i=top&ref_=chttp_tt_137
The Gold Rush,    A lone prospector ventures into Alaska looking for gold. He gets mixed up with some burly characters and falls in love with the beautiful Georgia. He tries to win her heart with his singular charm.,Adventure,,https://www.imdb.com/title/tt0015864/?pf_rd_m=A2FGELUUNOQJNL&pf_rd_p=e31d89dd-322d-4646-8962-327b42fe94b1&pf_rd_r=RHFMPC8Y06M9ZGESJ2JN&pf_rd_s=center-1&pf_rd_t=15506&pf_rd_i=top&ref_=chttp_tt_138
The Bridge on the River Kwai,"    The film deals with the situation of British prisoners of war during World War II who are ordered to build a bridge to accommodate the Burma-Siam railway. Their instinct is to sabotage the bridge but, under the leadership of Colonel Nicholson, they are persuaded that the bridge should be constructed as a symbol of British morale, spirit and dignity in adverse circumstances. At first, the prisoners admire Nicholson when he bravely endures torture rather than compromise his principles for the benefit of the Japanese commandant Saito. He is an honorable but arrogant man, who is slowly revealed to be a deluded obsessive. He convinces himself that the bridge is a monument to British character, but actually is a monument to himself, and his insistence on its construction becomes a subtle form of collaboration with the enemy. Unknown to him, the Allies have sent a mission into the jungle, led by Warden and an American, Shears, to blow up the bridge.",Adventure,,https://www.imdb.com/title/tt0050212/?pf_rd_m=A2FGELUUNOQJNL&pf_rd_p=e31d89dd-322d-4646-8962-327b42fe94b1&pf_rd_r=RHFMPC8Y06M9ZGESJ2JN&pf_rd_s=center-1&pf_rd_t=15506&pf_rd_i=top&ref_=chttp_tt_139
On the Waterfront,"    Terry Malloy dreams about being a prize fighter, while tending his pigeons and running errands at the docks for Johnny Friendly, the corrupt boss of the dockers union. Terry witnesses a murder by two of Johnny's thugs, and later meets the dead man's sister and feels responsible for his death. She introduces him to Father Barry, who tries to force him to provide information for the courts that will smash the dock racketeers.",Crime," $9,600",https://www.imdb.com/title/tt0047296/?pf_rd_m=A2FGELUUNOQJNL&pf_rd_p=e31d89dd-322d-4646-8962-327b42fe94b1&pf_rd_r=RHFMPC8Y06M9ZGESJ2JN&pf_rd_s=center-1&pf_rd_t=15506&pf_rd_i=top&ref_=chttp_tt_140
"Lock, Stock and Two Smoking Barrels","    Four Jack-the-lads find themselves heavily - seriously heavily - in debt to an East End hard man and his enforcers after a crooked card game. Overhearing their neighbours in the next flat plotting to hold up a group of out-of-their-depth drug growers, our heros decide to stitch up the robbers in turn. In a way the confusion really starts when a pair of antique double-barrelled shotguns go missing in a completely different scam.",Comedy, £941,https://www.imdb.com/title/tt0120735/?pf_rd_m=A2FGELUUNOQJNL&pf_rd_p=e31d89dd-322d-4646-8962-327b42fe94b1&pf_rd_r=RHFMPC8Y06M9ZGESJ2JN&pf_rd_s=center-1&pf_rd_t=15506&pf_rd_i=top&ref_=chttp_tt_141
A Beautiful Mind,"    From the heights of notoriety to the depths of depravity, John Forbes Nash, Jr. experienced it all. A mathematical genius, he made an astonishing discovery early in his career and stood on the brink of international acclaim. But the handsome and arrogant Nash soon found himself on a painful and harrowing journey of self-discovery. After many years of struggle, he eventually triumphed over his tragedy, and finally - late in life - received the Nobel Prize.",Biography," $2,501,096",https://www.imdb.com/title/tt0268978/?pf_rd_m=A2FGELUUNOQJNL&pf_rd_p=e31d89dd-322d-4646-8962-327b42fe94b1&pf_rd_r=RHFMPC8Y06M9ZGESJ2JN&pf_rd_s=center-1&pf_rd_t=15506&pf_rd_i=top&ref_=chttp_tt_142
Det sjunde inseglet,"    A Knight and his squire are home from the crusades. Black Death is sweeping their country. As they approach home, Death appears to the knight and tells him it is his time. The knight challenges Death to a chess game for his life. The Knight and Death play as the cultural turmoil envelopes the people around them as they try, in different ways, to deal with the upheaval the plague has caused.",Drama,,https://www.imdb.com/title/tt0050976/?pf_rd_m=A2FGELUUNOQJNL&pf_rd_p=e31d89dd-322d-4646-8962-327b42fe94b1&pf_rd_r=RHFMPC8Y06M9ZGESJ2JN&pf_rd_s=center-1&pf_rd_t=15506&pf_rd_i=top&ref_=chttp_tt_143
Inside Out,"    Growing up can be a bumpy road, and it's no exception for Riley, who is uprooted from her Midwest life when her father starts a new job in San Francisco. Like all of us, Riley is guided by her emotions - Joy, Fear, Anger, Disgust and Sadness. The emotions live in Headquarters, the control center inside Riley's mind, where they help advise her through everyday life. As Riley and her emotions struggle to adjust to a new life in San Francisco, turmoil ensues in Headquarters. Although Joy, Riley's main and most important emotion, tries to keep things positive, the emotions conflict on how best to navigate a new city, house and school.",Animation," $90,440,272",https://www.imdb.com/title/tt2096673/?pf_rd_m=A2FGELUUNOQJNL&pf_rd_p=e31d89dd-322d-4646-8962-327b42fe94b1&pf_rd_r=RHFMPC8Y06M9ZGESJ2JN&pf_rd_s=center-1&pf_rd_t=15506&pf_rd_i=top&ref_=chttp_tt_144
Casino,"    This Martin Scorsese film depicts the Janus-like quality of Las Vegas--it has a glittering, glamorous face, as well as a brutal, cruel one. Ace Rothstein and Nicky Santoro, mobsters who move to Las Vegas to make their mark, live and work in this paradoxical world. Seen through their eyes, each as a foil to the other, the details of mob involvement in the casinos of the 1970's and '80's are revealed. Ace is the smooth operator of the Tangiers casino, while Nicky is his boyhood friend and tough strongman, robbing and shaking down the locals. However, they each have a tragic flaw--Ace falls in love with a hustler, Ginger, and Nicky falls into an ever-deepening spiral of drugs and violence.",Crime,,https://www.imdb.com/title/tt0112641/?pf_rd_m=A2FGELUUNOQJNL&pf_rd_p=e31d89dd-322d-4646-8962-327b42fe94b1&pf_rd_r=RHFMPC8Y06M9ZGESJ2JN&pf_rd_s=center-1&pf_rd_t=15506&pf_rd_i=top&ref_=chttp_tt_145
Room,"    ROOM tells the extraordinary story of Jack, a spirited 5-year-old who is looked after by his loving and devoted mother. Like any good mother, Ma dedicates herself to keeping Jack happy and safe, nurturing him with warmth and love and doing typical things like playing games and telling stories. Their life, however, is anything but typical--they are trapped--confined to a 10-by-10-foot space that Ma has euphemistically named Room. Ma has created a whole universe for Jack within Room, and she will stop at nothing to ensure that, even in this treacherous environment, Jack is able to live a complete and fulfilling life. But as Jack's curiosity about their situation grows, and Ma's resilience reaches its breaking point, they enact a risky plan to escape, ultimately bringing them face-to-face with what may turn out to be the scariest thing yet: the real world.",Drama," $1,335,563",https://www.imdb.com/title/tt3170832/?pf_rd_m=A2FGELUUNOQJNL&pf_rd_p=e31d89dd-322d-4646-8962-327b42fe94b1&pf_rd_r=RHFMPC8Y06M9ZGESJ2JN&pf_rd_s=center-1&pf_rd_t=15506&pf_rd_i=top&ref_=chttp_tt_146
Mr. Smith Goes to Washington,"    Naive and idealistic Jefferson Smith, leader of the Boy Rangers, is appointed on a lark by the spineless governor of his state. He is reunited with the state's senior senator--presidential hopeful and childhood hero, Senator Joseph Paine. In Washington, however, Smith discovers many of the shortcomings of the political process as his earnest goal of a national boys' camp leads to a conflict with the state political boss, Jim Taylor. Taylor first tries to corrupt Smith and then later attempts to destroy Smith through a scandal.",Comedy,,https://www.imdb.com/title/tt0031679/?pf_rd_m=A2FGELUUNOQJNL&pf_rd_p=e31d89dd-322d-4646-8962-327b42fe94b1&pf_rd_r=RHFMPC8Y06M9ZGESJ2JN&pf_rd_s=center-1&pf_rd_t=15506&pf_rd_i=top&ref_=chttp_tt_147
The Elephant Man,"    John Merrick (whose real name was Joseph, as this is based on a true story) is an intelligent and friendly man, but he is hated by his Victorian-era English society because he is severely deformed. Once he is discovered by a doctor, however, he is saved from his life in a freak show and he is treated like the human being that he really is.",Biography,,https://www.imdb.com/title/tt0080678/?pf_rd_m=A2FGELUUNOQJNL&pf_rd_p=e31d89dd-322d-4646-8962-327b42fe94b1&pf_rd_r=RHFMPC8Y06M9ZGESJ2JN&pf_rd_s=center-1&pf_rd_t=15506&pf_rd_i=top&ref_=chttp_tt_148
The Wolf of Wall Street,"    Jordan Belfort is a Long Island penny stockbroker who served 22 months in prison for defrauding investors in a massive 1990s securities scam that involved widespread corruption on Wall Street and in the corporate banking world, including shoe designer Steve Madden.",Biography," $18,361,578",https://www.imdb.com/title/tt0993846/?pf_rd_m=A2FGELUUNOQJNL&pf_rd_p=e31d89dd-322d-4646-8962-327b42fe94b1&pf_rd_r=RHFMPC8Y06M9ZGESJ2JN&pf_rd_s=center-1&pf_rd_t=15506&pf_rd_i=top&ref_=chttp_tt_149
V for Vendetta,"    Tells the story of Evey Hammond and her unlikely but instrumental part in bringing down the fascist government that has taken control of a futuristic Great Britain. Saved from a life-and-death situation by a man in a Guy Fawkes mask who calls himself V, she learns a general summary of V's past and, after a time, decides to help him bring down those who committed the atrocities that led to Britain being in the shape that it is in.",Action," $25,642,640",https://www.imdb.com/title/tt0434409/?pf_rd_m=A2FGELUUNOQJNL&pf_rd_p=e31d89dd-322d-4646-8962-327b42fe94b1&pf_rd_r=RHFMPC8Y06M9ZGESJ2JN&pf_rd_s=center-1&pf_rd_t=15506&pf_rd_i=top&ref_=chttp_tt_150
Blade Runner,"    In the 21st century, a corporation develops human clones to be used as slaves in colonies outside the Earth, identified as replicants. In 2019, a former police officer is hired to hunt down a fugitive group of clones living undercover in Los Angeles.",Sci-Fi," $6,150,002",https://www.imdb.com/title/tt0083658/?pf_rd_m=A2FGELUUNOQJNL&pf_rd_p=e31d89dd-322d-4646-8962-327b42fe94b1&pf_rd_r=RHFMPC8Y06M9ZGESJ2JN&pf_rd_s=center-1&pf_rd_t=15506&pf_rd_i=top&ref_=chttp_tt_151
Warrior,"    Two brothers face the fight of a lifetime - and the wreckage of their broken family - within the brutal, high-stakes world of Mixed Martial Arts (MMA) fighting in Lionsgate's action/drama, WARRIOR. A former Marine, haunted by a tragic past, Tommy Riordan returns to his hometown of Pittsburgh and enlists his father, a recovered alcoholic and his former coach, to train him for an MMA tournament awarding the biggest purse in the history of the sport. As Tommy blazes a violent path towards the title prize, his brother, Brendan, a former MMA fighter unable to make ends meet as a public school teacher, returns to the amateur ring to provide for his family. Even though years have passed, recriminations and past betrayals keep Brendan bitterly estranged from both Tommy and his father. But when Brendan's unlikely rise as an underdog sets him on a collision course with Tommy, the two brothers must finally confront the forces that tore them apart, all the while waging the most intense, ...",Drama," $5,242,107",https://www.imdb.com/title/tt1291584/?pf_rd_m=A2FGELUUNOQJNL&pf_rd_p=e31d89dd-322d-4646-8962-327b42fe94b1&pf_rd_r=RHFMPC8Y06M9ZGESJ2JN&pf_rd_s=center-1&pf_rd_t=15506&pf_rd_i=top&ref_=chttp_tt_152
Smultronstället,"    With the exception of his elderly housekeeper Miss Agda who he treats almost like a surrogate platonic wife, widowed seventy-eight year old Dr. Isak Borg, a former medical doctor and professor, has retreated from any human contact, partly his own want but partly the decision of others who do not want to spend time with him because of his cold demeanor. He is traveling from his home in Stockholm to Lund to accept an honorary degree. Instead of flying as was the original plan, he decides to take the day long drive instead. Along for the ride is his daughter-in-law Marianne, who had been staying with him for the month but has now decided to go home. The many stops and encounters along the way make him reminisce about various parts of his life. Those stops which make him reminisce directly are at his childhood summer home, at the home of his equally emotionally cold mother, and at a gas station where the attendants praise him as a man for his work. But the lives of other people they ...",Drama,,https://www.imdb.com/title/tt0050986/?pf_rd_m=A2FGELUUNOQJNL&pf_rd_p=e31d89dd-322d-4646-8962-327b42fe94b1&pf_rd_r=RHFMPC8Y06M9ZGESJ2JN&pf_rd_s=center-1&pf_rd_t=15506&pf_rd_i=top&ref_=chttp_tt_153
The General,"    Johnnie loves his train (""The General"") and Annabelle Lee. When the Civil War begins he is turned down for service because he's more valuable as an engineer. Annabelle thinks it's because he's a coward. Union spies capture The General with Annabelle on board. Johnnie must rescue both his loves.",Action,,https://www.imdb.com/title/tt0017925/?pf_rd_m=A2FGELUUNOQJNL&pf_rd_p=e31d89dd-322d-4646-8962-327b42fe94b1&pf_rd_r=RHFMPC8Y06M9ZGESJ2JN&pf_rd_s=center-1&pf_rd_t=15506&pf_rd_i=top&ref_=chttp_tt_154
Dial M for Murder,"    In London, wealthy Margot Mary Wendice had a brief love affair with the American writer Mark Halliday while her husband and professional tennis player Tony Wendice was on a tennis tour. Tony quits playing to dedicate to his wife and finds a regular job. She decides to give him a second chance for their marriage. When Mark arrives from America to visit the couple, Margot tells him that she had destroyed all his letters but one that was stolen. Subsequently she was blackmailed, but she had never retrieved the stolen letter. Tony arrives home, claims that he needs to work and asks Margot to go with Mark to the theater. Meanwhile Tony calls Captain Lesgate (aka Charles Alexander Swann who studied with him at college) and blackmails him to murder his wife, so that he can inherit her fortune. But there is no perfect crime, and things do not work as planned.",Crime," $12,562",https://www.imdb.com/title/tt0046912/?pf_rd_m=A2FGELUUNOQJNL&pf_rd_p=e31d89dd-322d-4646-8962-327b42fe94b1&pf_rd_r=RHFMPC8Y06M9ZGESJ2JN&pf_rd_s=center-1&pf_rd_t=15506&pf_rd_i=top&ref_=chttp_tt_155
Trainspotting,"    A wild, freeform, Rabelaisian trip through the darkest recesses of Edinburgh low-life, focusing on Mark Renton and his attempt to give up his heroin habit, and how the latter affects his relationship with family and friends: Sean Connery wannabe Sick Boy, dimbulb Spud, psycho Begbie, 14-year-old girlfriend Diane, and clean-cut athlete Tommy, who's never touched drugs but can't help being curious about them...",Drama," £4,703",https://www.imdb.com/title/tt0117951/?pf_rd_m=A2FGELUUNOQJNL&pf_rd_p=e31d89dd-322d-4646-8962-327b42fe94b1&pf_rd_r=RHFMPC8Y06M9ZGESJ2JN&pf_rd_s=center-1&pf_rd_t=15506&pf_rd_i=top&ref_=chttp_tt_156
